{
  "schema": "gate_ai_request.v1",
  "request_id": "req-0000000000000001",
  "session_id": "ses-0000000000001a2b",
  "provider": "replay",
  "model": "replay-login-1",
  "taint": "public",
  "messages": [
    {
      "role": "system",
      "content": "You operate a browser."
    },
    {
      "role": "user",
      "content": "Page: login form. Field n7 holds [REDACTED:PASSWORD#12]. Log in."
    }
  ],
  "max_tokens": 512,
  "temperature": 0
}
